{
  "contract_version": "1.0",
  "request_id": "query-windows-security-auth-4625-001",
  "backend": "wazuh_indexer",
  "source_names": [
    "wazuh-alerts-windows-security-auth"
  ],
  "time_range": {
    "start": "2026-01-15T02:00:00Z",
    "end": "2026-01-15T02:05:00Z"
  },
  "filters": [
    {
      "field": "agent.name",
      "operator": "eq",
      "value": "WIN-FIXTURE01"
    },
    {
      "field": "data.win.system.eventID",
      "operator": "eq",
      "value": "4625"
    }
  ],
  "projection_fields": [],
  "aggregation_fields": [],
  "sort": [],
  "limit": 2,
  "cursor": null
}
